"id";"product_name";"countries";"ingredients";"brands";"stores";"energy";"fat";"carbohydrates";"proteins";"saturated-fat";"sugars";"sodium";"fiber";"salt";"iron";"image_url"
"29067657";"King'sCrown Maiskölbchen süß-sauer";"Deutschland";"Maiskölbchen, Wasser, Zucker, Branntweinessig, Salz, Säuerungsmittel, Citronensäure";"King's Crown";"";"0";"0.5";"11";"2";"0.1";"9.6";"0.3110236220472441";"0";"0.79";"0";""
"2508627906708";"Sesam";"Deutschland";"_Sesam_, ungeschält.";"Bio-Zentrale";"";"0";"50";"10";"21";"7.6";"0.2";"0.04330708661417323";"11";"0.11";"0";""
"3078354562571";"Céréales faciles recette provençale";"France";"Graines de couscous, 36‚, boulgour, BLÉ, 36‚, céréales, graines de lin brun, graines de tournesol, tomate, arômes, huile de tournesol, sel, herbe de Provence, colorant, extrait de paprika, extrait naturel de romarin., flocons de BLÉ, flocons de SEIGLE";"Lustucru";"";"0";"7.9";"59";"13.7";"0.89";"2.9";"0.748031496062992";"7.7";"1.9";"0";""
"0834751000039";"Organic quinoa ancient blend";"United States";"";"Sonoma Valley";"";"0";"2.5";"40";"8";"0.5";"0";"0";"4";"0";"15";""
"3229820769219";"Purée Lentilles corail potiron Bio - 250 g - Bjorg";"France";"Lentilles décortiquées cuites*, potiron*, eau, oignons*, huile d'olive*, sel.";"Bjorg";"Carrefour";"0";"1.7";"13.9";"7.7";"0.2";"2.8";"0.25";"3.5";"0";"0";""
"3229820159775";"Soj' Apéro Mix!";"France";"Graines de _soja_, 61‚, graines de courge, graines de tournesol, sel marin non raffiné.";"Bjorg";"Auchan";"0";"35.5";"7.4";"36.5";"5";"4.9";"1.1811023622047243";"13.4";"3";"6.3";""
"3229820188751";"Lentilles Carottes Bio";"France";"Lentilles vertes précuites*, carottes précuites, sel marin de l’Atlantique non raffiné, huile de tournesol*.";"Bjorg";"Carrefour";"0";"1.6";"13.4";"7.3";"0.2";"1.1";"0.2";"6";"0.508";"0";""
"3229820188744";"Quinoa Lentilles Bio - 250 g - Bjorg";"France";"Quinoa précuit*, lentilles précuites*, sel marin de l'Atlantique non raffiné, huile de tournesol*.";"Bjorg";"Carrefour";"0";"2.8";"23";"8";"0.5";"0.1";"0.4";"5.5";"0";"0";""
"3229820784861";"Riz complet à poêler bio";"France, Europe";"Riz complet précuit et flocons de riz complet 89‚, flocons de légumineuses, carottes déshydratées., pois cassé 4‚, soja, azuki, pois chiche";"Bjorg";"";"0";"4.8";"71.1";"10.2";"1";"1.3";"0.004";"4.9";"0";"0";""
"3229820786865";"Avoine cuisine Bio Bjorg";"France";"eau, *avoine, *huile de tournesol pressée à froid. épaississants, gomme de guar et gomme de xanthane, sel marin.";"Bjorg";"Carrefour";"0";"7.6";"5.8";"0.6";"0.7";"0.5";"0.04";"0.6";"0";"0";""
"3229820785929";"Avoine façon risotto aux légumes";"France";"Gruau d'avoine précuit 35‚, gluten, riz rond complet précuit 19‚, eau, petits légumes 19‚, huile d'olive, farine complète de riz, bouillon de légumes, ., carottes, petits pois, brocolis, poireaux, sel de mer non raffiné, extrait de levure, riz, huile de tournesol, oignon, céleri, épices, persil";"Bjorg";"Monoprix";"0";"3.2";"23.2";"4.9";"0.3";"0.1";"0.3";"3.2";"0";"0";""
"3229820786209";"Salade Lentilles et légumes Bio - 180 g - Bjorg";"France";"Lentilles vertes précuites*, Légumes* 16‚, Grains de Soja Précuits* 7‚, Eau, Huile de colza*, Moutarde de Dijon*, Vinaigre de vin issu de raisins biologiques, Sel non raffiné de l'Atlantique, Ail*, Persil*, Jus concentré de citron*, Poivre Blanc*., Oignons*, Pulpe de tomates*, Courgettes*, Carottes*";"Bjorg";"Carrefour";"0";"5.8";"12.5";"6.8";"0.4";"1.5";"0.4";"4.2";"0";"0";""
"3229820780566";"Son d'Avoine Bio";"France";"Son d'_avoine_.";"Bjorg";"";"0";"8";"46.9";"16";"1.5";"2";"0";"15";"0";"0";""
"3229820165431";"Soja Gratin Bio Bjorg";"France";"*Tonyu, *farine de blé, *huile de tournesol oléique, *amidon de blé, émulsifiant, lécithine de tournesol, sel marin, *noix de muscade, épaississants, gomme guar et gomme xanthane, arôme naturel de poivre, arôme naturel de noix de muscade., eau, *fèves de soja sans OGM 7‚";"Bjorg";"Carrefour";"0";"7.3";"6.3";"4.1";"2.3";"1.2";"0.2";"0.7";"0";"0";""
"3227291070018";"Lentilles Légumes Vapeur - 500 g - Lunor";"France";"Lentilles, sel, arôme naturel.";"Lunor";"Leclerc";"0";"0.7";"21.3";"9.6";"0";"1.3";"0.291";"9.4";"0";"2.7";""
"3222472975540";"riz rond";"France";"";"casino";"";"0";"0";"0";"0";"0";"0";"0";"0";"0";"0";""
"3222471002612";"Pois cassés";"France";"pois secs cassés";"Casino";"";"0";"1.6";"56";"22";"0.2";"1.8";"0.02";"6.3";"0";"4";""
"3222471002599";"Lentilles vertes - 500 g - Casino";"France";"Lentilles vertes. Traces de gluten. Matière première d'importation.";"Casino";"Casino";"0";"1.7";"50";"24";"0.2";"1";"0.01";"11";"0";"0";""
"3222471135297";"Riz long grain";"France";"Riz long grain étuvé de qualité supérieure";"Casino";"Casino";"0";"0.7";"78";"7.5";"0.1";"0";"0";"0";"0";"0";""
"3222471623718";"Lentilles préparées Casino";"France";"Lentilles sèches trempées, eau, sel, arôme naturel, contient céleri, .";"Casino";"Casino";"0";"0.5";"15.6";"7.8";"0.1";"0.5";"0.49";"5.5";"0";"0";""
"3222474196547";"Lentilles corail Bio - 500 g - Casino";"France";"Lentilles corail issues de l'agriculture biologique.";"Casino";"Casino";"0";"1.7";"42";"23";"0.3";"2.5";"0.01";"19";"0";"5.6";""
"3222474196554";"Riz blanc Long grain incollable Bio Casino";"France";"Riz long grain étuvé, issu de l'agriculture biologique.";"Casino";"Casino";"0";"1.1";"72";"7.7";"0.2";"0.8";"0.01";"4";"0";"0";""
"3222472764793";"Thaï";"France";"Riz thaï long grain de qualité supérieure";"Casino";"Casino";"0";"0.6";"47";"4.8";"0";"0";"0";"0";"0";"0";""
"3222472845751";"Quinoa origine Bolivie";"France";"Graines de Quinoa, issues de l'agriculture biologique";"Casino, Casino Bio";"";"0";"6.3";"68";"12";"0";"0";"0";"0";"0";"0";""
"3222474714895";"Mélange de céréales (Boulgour, soja, quinoa rouge)";"France";"boulgour, blé, graines de soja concassées toastées, flocons de soja toastés, quinoa rouge";"Casino";"Casino";"0";"8.7";"45";"22";"1.2";"4.8";"0.01968503937007874";"14";"0.05";"0";""
"3222471962558";"Lentilles vertes Bio";"France";"Lentilles vertes issues de l'agriculture biologique.";"Casino, Casino Bio";"Casino";"0";"1.3";"33";"26";"0.2";"2.1";"0.01";"25";"0.0254";"8";""
"3222470004822";"Riz Long Grain";"France";"Riz long grain étuvé de qualité supérieure.";"Casino";"Géant Casino";"0";"0.7";"78";"7.5";"0.1";"0";"0";"0";"0";"0";""
"3222475325359";"Lentilles vertes de France";"France";"";"Casino";"";"0";"0";"0";"0";"0";"0";"0";"0";"0";"0";""
"3222472185338";"Riz long grain Camargue";"France";"Riz blanc de Camargue long grain de qualité supérieure.";"Casino";"Casino";"0";"0.3";"81";"7.8";"0.1";"0";"0.01";"1.6";"0";"0";""
"3222475112638";"Son d'avoine";"France";"Son d'avoine issu de l'agriculture biologique.";"Casino Bio";"Casino";"0";"7.8";"48";"15";"0.8";"2";"0.01";"15";"0";"0";""
"3222473592241";"Riz semi-complet Bio Casino";"France";"Riz brun long grain de qualité supérieure";"Casino";"Casino";"0";"1.7";"75";"7.2";"0.8";"0.4";"0.01";"2.3";"0.0254";"0";""
"3222475714429";"Riz complet 10min";"France";"Riz long grain complet étuvé.";"Casino";"Géant Casino";"0";"3.3";"70";"8.2";"0.3";"0.5";"0";"0";"0 ";"0";""
"3222472685227";"Selection 3 riz";"France";"";"casino";"";"0";"0";"0";"0";"0";"0";"0";"0";"0";"0";""
"3222472992400";"Grains de blé précuits ";"France";"Grains de _blé_ dur précuits.";"Casino";"Casino";"0";"1.8";"67";"15";"0.7";"0.5";"0.01";"6.3";"0";"0";""
"3222473039579";"Riz naturellement parfumé Thaï";"France";"Riz Thaï long grain de qualité supérieure";"Casino";"";"0";"1";"80";"8";"0.1";"0";"0.01";"1.6";"0";"0";""
"3222473039586";"Thaï";"France";"Riz thaï long grain de qualité supérieure";"Casino";"Casino";"0";"1";"78";"8";"0.1";"0";"0";"0";"0";"0";""
"3222472559276";"Riz Basmati naturellement parfumé Bio Casino";"France";"Riz basmati long grain de qualité supérieure";"Casino";"Casino";"0";"1.2";"75";"9.5";"0.3";"0";"0";"0";"0";"0";""
"3222472711506";"Riz thaï naturellement parfumé Bio Casino";"France";"Riz thaï long grain de qualité supérieure";"Casino";"Casino";"0";"0.7";"77";"7";"0.2";"0";"0";"0";"0";"0";""
"20166090";"Rote Kidney Bohnen";"Deutschland";"Rote Bohnen, Wasser, Zucker, Speisesalz, modifizierte Maisstärke, Antioxidationsmittel, Ascorbinsäure";"Campo Largo, Freshona";"Lidl";"0";"1.0";"12.6";"8.4";"0.1";"3.0";"0.39370078740157477";"0";"1.00";"0";""
"20245450";"Almendras tostadas con sal Variedad Largueta";"España";"_Almendra_ largueta con piel, harina de arroz y sal, .";"Alesto, //Propiedad de://, Lidl Stiftung & Co. KG, //Perteneciente a://, Schwarz Beteiligungs GmbH";"Lidl";"0";"56.5";"3.8";"24.7";"4.5";"2.1";"0.7";"13.3";"1.778";"0";""
"07722189";"Tad Al";"France";"sel, pois chiches";"Tad Al";"";"0";"0";"0";"0";"0";"0";"0";"0";"0";"0";""
"3353661111187";"Pois chiches du Lauragais";"France";"";"Arterris";"";"0";"0";"0";"0";"0";"0";"0";"0";"0";"0";""
"3352395110206";"Graines de Sésame";"France";"graines de _sésame_.";"";"";"0";"0";"0";"0";"0";"0";"0";"0";"0";"0";""
"3350031953170";"Riz Thaï bio";"France";"Riz thaï long grain, issu de l'agriculture biologique.";"Monoprix, Monoprix bio";"Monoprix";"0";"0.8";"77";"7.4";"0.2";"0.7";"0.01";"1.2";"0";"0";""
"3350031959042";"Riz Basmati 10 minutes 1 Kg Monoprix";"France";"Riz long grain Basmati de qualité supérieure.";"Monoprix";"Monoprix";"0";"1.8";"71";"11";"0.1";"0";"0.01";"1.6";"0";"0";""
"3350031953187";"Riz Basmati Bio Monoprix";"France";"Riz Basmati long grain, issu de l'agriculture biologique.";"Monoprix";"Monoprix";"0";"0.6";"78";"7.6";"0.1";"0.3";"0.01";"0.9";"0";"0";""
"3350031953194";"Lentilles corail";"France";"";"monoprix bio, Monoprix";"";"0";"0";"0";"0";"0";"0";"0";"0";"0";"0";""
"3350033210110";"Lentilles vertes du Berry Monoprix gourmet";"France";"";"Monoprix";"";"0";"0";"0";"0";"0";"0";"0";"0";"0";"0";""
"3350031627590";"Riz Thaï 10 minutes 500 g Monoprix";"France";"Riz Thaï long grain de qualité supérieure.";"Monoprix";"Monoprix";"0";"1";"80";"8";"0.1";"0";"0.01";"1.6";"0";"0";""
"3350031627576";"Riz Basmati 10 minutes 500 g Monoprix";"France";"Riz long grain Basmati de qualité supérieure.";"Monoprix";"Monoprix";"0";"1.8";"71";"11";"0.1";"0";"0.01";"1.6";"0";"0";""
"3350031644757";"Blé précuit prêt en 10 minutes - 500 g - Monoprix";"France";"Grains de blé dur précuits.";"Monoprix";"Monoprix";"0";"1.8";"67";"15";"0.7";"0.5";"0.01";"6.3";"0";"0";""
"3350031642869";"Riz long blanc Bio Monoprix";"France";"Riz long blanc*, * issu de l'agriculture biologique.";"Monoprix";"Monoprix";"0";"1.1";"77";"6.1";"0";"0";"0";"1";"0";"0";""
"3350031642883";"Riz long complet Bio Monoprix";"France";"Riz long complet*, * issu de l'agriculture biologique.";"Monoprix";"Monoprix";"0";"2.2";"71";"7.4";"0";"1.2";"0";"3";"0";"0";""
"3350031949739";"Mélange de 5 céréales Bio Monoprix";"France";"Épeautre*, orge*, riz long complet*, blé khorasan KAMUT*, avoine* 5%., * Ingrédients issus de l'agriculture biologique.";"Monoprix";"Monoprix";"0";"2.4";"69";"11";"0.6";"0.7";"0";"7.1";"0";"0";""
"3350031949722";"Mélange quinoa boulgour Bio Monoprix";"France";"Boulgour de blé dur*, quinoa rouge*, * Ingrédients issus de l'agriculture biologique.";"Monoprix";"Monoprix";"0";"2.9";"63";"14";"0.5";"1.4";"0";"7.6";"0";"2.3";""
"3350030211264";"Houmous au sésame et huile d'olive 3,2%";"France";"Pois chiche, purée de graines de _sésame_, _fromage_ blanc, préparation à base de jus de citron concentré, huile de colza, huile d'olive vierge extra 3‚, sel, ail, eau, conservateur, E202, antioxydant, E330., eau, jus de citron à base de concentré, acidifiant, E330, conservateur, E202, antioxydant, E300, épaississant, E414, extraits naturels de citron";"Monoprix Gourmet";"Monoprix";"0";"0";"0";"0";"0";"0";"0";"0";"0";"0";""
"3350031905643";"Riz rond 17 minutes Monoprix";"France";"Riz rond de qualité supérieure.";"Monoprix";"Monoprix";"0";"0.6";"78";"6.6";"0.1";"0";"0.01";"1.6";"0";"0";""
"3350031630729";"Riz long grain Thaï Monoprix Gourmet";"France";"Riz long grain parfumé, conforme aux standards Max Havelaar.

Origine, Thaïlande.";"Monoprix";"Monoprix";"0";"1";"80";"7.2";"0";"0";"0";"0.5";"0";"0";""
"3350031662317";"Riz pour risotto Arborio Monoprix Gourmet";"France";"Riz, variété Arborio";"Monoprix";"Monoprix";"0";"1.1";"77";"7.3";"0";"0";"0";"1";"0";"0";""
"3350031662300";"Mélange savoureux 3 riz Monoprix Gourmet";"France";"Riz long grain étuvé, riz sauvage*, riz complet rouge 20%.";"Monoprix";"Monoprix";"0";"2.3";"72";"8.8";"0.5";"1";"0.01";"2.9";"0";"0";""
"3350031662324";"Riz long blanc Camargue Monoprix Gourmet";"France";"Riz long blanc, origine Camargue.";"Monoprix";"Monoprix";"0";"0.7";"78";"7.2";"0";"0";"0";"1.2";"0";"0";""
"3350031764622";"Riz long grain Basmati Monoprix Gourmet";"France";"Riz basmati conforme aux standards Max Havelaar.

Origine, Inde.";"Monoprix";"Monoprix";"0";"1.2";"76";"8.5";"0";"0";"0";"0.8";"0";"0";""
"3350031753534";"Riz Basmati délicatement parfumé Monoprix";"France";"Riz long basmati étuvé précuit, huile de tournesol, sel, extraits naturels d'épices, lait, antioxydant, E330, coriandre.";"Monoprix";"Monoprix";"0";"2.5";"31";"4.1";"0.28";"0.52";"0.22";"1.9";"0";"0";""
"3350031753541";"Riz Basmati au curry à l'indienne Monoprix";"France";"Riz long basmati étuvé précuit, huile de tournesol, sel, épices et aromates, ail, sucre, curry 0‚, moutarde, .";"Monoprix";"Monoprix";"0";"1.9";"30";"4.5";"0.32";"0.73";"0.48";"1.7";"0";"0";""
"3350033037472";"Lentilles au saumon fumé et sauce gravlax";"France";"lentilles, saumon atlantique fumé, sauce gravlax, jaune d’œuf, vinaigre d'alcool, sel, épaississants, E412, E415), crème, moutarde de Dijon, échalote, sucre, vinaigre de vin rouge 0‚, aneth 0‚, jus de citron à base de concentré, curcuma, sel, épaississants, E412, E415), courgette, tomate, sauce, moutarde de Dijon, amidon transformé de tapioca, épaississants, E415), sel, arômes naturels), jeune pousse de salade, huile d'olive vierge extra, condiment balsamique blanc, sel, poivre blanc., eau, lentilles vertes, saumon, sel, sauce condimentaire, huile de colza, eau, moutarde, eau, graines de moutarde, vinaigre, sel, conservateur, E222, dont stabilisant, E407, 0‚, eau, graines de moutarde, vinaigre, sel, conservateur, E222, dont conservateur, E222, dont antioxydants, E300, E220, eau, huile de colza, vinaigre d'alcool, sucre, acidifiants, E270, E330, E325, eau, graines de moutarde, vinaigre, sel, conservateur, E222, E401, vinaigre de vin, moût de raisin, colorant, E150a, conservateur, E224";"Monop' Daily, Monoprix";"TGV Strasbourg-Marseille";"0";"7.6";"9.5";"8.5";"1.2";"1.5";"0.512";"7.1";"1.30048";"0";""
"3350031616242";"Riz long grain 4 sachets cuisson Monoprix";"France";"Riz long grain étuvé de qualité supérieure.";"Monoprix";"Monoprix";"0";"0.6";"78";"7";"0.2";"0";"0.01";"1.4";"0";"0";""
"3350031616259";"Riz Basmati 4 sachets cuisson Monoprix";"France";"Riz long grain Basmati de qualité supérieure.";"Monoprix";"Monoprix";"0";"0.6";"78";"6.6";"0.2";"0";"0.01";"1.4";"0.0254";"0";""
"3350031616228";"Riz long grain";"France";"";"Monoprix";"";"0";"0";"0";"0";"0";"0";"0";"0";"0";"0";""
"3350031747489";"Riz Basmati citron et aneth Monoprix";"France";"Riz long basmati étuvé précuit, préparation à base d'huile de colza aromatisée au citron 1‚, sel, jus de citron concentré 0‚, fumet de poisson aromatisé, aneth 0‚, extraits naturels d'épices, lait, ., huile de colza, arôme naturel de citron 0‚, émulsifiant, E472c, arôme, colorant, E160aii, maltodextrine de pomme de terre, sel, arômes naturels, poisson déshydraté, extrait de levure, épices et aromates";"Monoprix";"Monoprix";"0";"2.4";"31";"4.5";"0.22";"0.57";"0.26";"1.2";"0";"0";""
"3254560064911";"pois chiches";"France";"";"Auchan";"";"0";"0";"0";"0";"0";"0";"0";"0";"0";"0";""
"3254560089334";"Riz très long Surinam";"France";"riz très long de qualité supérieure";"Auchan";"Simply";"0";"0.5";"76.5";"7";"0.2";"0.2";"0";"1.5";"0";"0";""
"3254560088269";"Riz long grain incollable";"France";"riz long grain étuvé de qualité supérieure";"Auchan";"";"0";"0.8";"79";"7.3";"0.2";"0.3";"0.007874015748031496";"1.5";"0.02";"0";""
"3254560030169";"Riz long grain";"France";"Riz long grain étuvé";"Auchan";"Auchan, Chronodrive";"0";"0.5";"76";"7.7";"0.3";"0.01";"0.003937007874015748";"1.5";"0.01";"0";""
"3254560035584";"Riz basmati ";"France";"";"Auchan";"";"0";"0";"0";"0";"0";"0";"0";"0";"0";"0";""
"3254560023352";"Petit salé aux lentilles";"France";"Eau, lentilles réhydratées, viande de porc traitée en salaison précuite, carottes, 2‚, saindoux, concentré de tomates, oignons, arômes, aromates, amidon transformé, viande de porc, eau, sel, stabilisant, triphosphate, gélifiant, algues euchéma transformées, contient _gluten_, _blé_ et _orge_, oignon, ail";"Auchan";"Auchan";"0";"4";"7.5";"9";"1.5";"1";"0.3307086614173228";"2.4";"0.84";"0";""
"3254560694125";"Riz parfumé";"France";"Riz thai long grain de qualité supérieure";"Carrefour";"Carrefour";"0";"0.5";"77";"7";"0.2";"0.2";"Traces";"1.5";"0";"0";""
"3254560049086";"Riz long grain incollable  (cuisson rapide 10 mn) ";"France";"Riz long grain étuvé de qualité supérieure.";"Auchan";"Auchan, Banque alimentaire";"0";"0.5";"76";"7.7";"0.3";"0.2";"0";"1.5";"0";"0";""
"3254474016624";"Express Maïs doux Extra Croquant";"France";"Maïs doux en grains sans OGM, eau, sel";"Géant Vert";"";"0";"1.7";"10.6";"2.4";"0.4";"5.7";"0.13779527559055116";"2.6";"0.35";"0";""
"3255691007846";"Épis de maïs mini";"France";"Ingrédients, mini épis de maïs, eau, sel, acidifiant, acide citrique, anti-oxydant, acide ascorbique.";"Rochefontaine";"Carrefour";"0";"0.2";"4";"1.6";"0";"2.1";"0.35";"1.4";"0";"0";""
"3259010201106";"Grinioc petit épeautre et légumes";"France";"boulgour de _blé_ complet précuit, petit épeautre, _blé_, précuit, huiles végétales, tournesol oléique désodorisée et tournesol, carottes, oignons, flocons de _blé_ complet, flocons d'_avoine_ complète, concentré de tomate, poivrons rouges, _céleri_ rave, farine de riz, ail, raisins secs, sel de mer, gluten de _blé_, épices";"soy";"";"0";"10";"27";"5.7";"1";"3.6";"0.3543307086614173";"6.1";"0.9";"0";""
"3259011105977";"Tofou soyeux";"France";"Ingrédients, _soja_* décortiquè 10‚, gélifiant, nigari). 
*Ingrédients issus de l'agriculture biologique., tofu*, eau";"Soy";"";"0";"2.9";"1.4";"5.2";"0.5";"0.9";"0.0118";"0";"0.029972";"0";""
"3250390801863";"Sésame";"France";"Sésame";"Cigalou, Sélection Intermarché";"Intermarché";"0";"0";"0";"0";"0";"0";"0";"0";"0";"0";""
"3250391418107";"Riz complet ";"France";"Riz long grain complet étuvé de qualité supérieure.Trace éventuelle de blé .";"Saint Eloi";"Intermarché";"0";"3.3";"72";"7.5";"0.6";"0.3";"0.015748031496062992";"0";"0.04";"0";""
"3250391418046";"Riz long grain";"France";"Riz long grain étuvé de qualité supérieure";"Saint Eloi";"Intermarché";"0";"0.9";"78.7";"7.7";"0.2";"0.6";"0.003937007874015748";"0";"0.01";"0";""
"3250390139577";"Riz Long Grain Incollable & de qualité supérieure (10 min.)";"France";"Riz long grain étuvé de qualité supérieure.";"Saint Eloi, Sélection des Mousquetaires, Les Mousquetaires";"Intermarché";"0";"0.9";"78.7";"7.7";"0.2";"0.6";"0.003937007874015748";"0";"0.01";"0";""
"3250390411765";"Sachet 10 min riz long grain";"France, Europe";"Riz long grain étuvé de qualité supérieure";"Saint Eloi";"Intermarché";"0";"1";"81";"7";"0.2";"0.2";"0.01";"1.8";"0";"0";""
"3250390604600";"Lentilles Vertes";"France";"Lentilles vertes.";"Saint Eloi, Sélection des Mousquetaires, Les Mousquetaires";"Intermarché";"0";"1.3";"42.3";"24.7";"0.2";"1";"0.01";"19.6";"0.0254";"7.3";""
"3250391045600";"Mélange Fruits & Graines";"France";"";"Bouton d'Or";"Intermarché";"0";"20.9";"53.9";"6.3";"3.9";"51.6";"0.12598425196850394";"0";"0.32";"0";""
"3250390004639";"Lentilles Vertes ";"France";"Lentilles vertes.";"Saint Eloi, Sélection des Mousquetaires, Les Mousquetaires";"Intermarché";"0";"1.4";"48.6";"25.1";"0.2";"0.9";"0.01";"12.4";"0.025400000000000002";"0";""
"3250390004554";"Lentilles blondes";"France";"Lentilles blondes.";"Saint Eloi, Sélection des Mousquetaires, Les Mousquetaires";"Intermarché";"0";"1.6";"41.4";"22.1";"0.3";"1.2";"0.01";"21.5";"0.0254";"0";""
"3250390005162";"Lentilles préparées";"France";"Lentilles sèches trempées, eau, sel, sucre, arôme, arôme de fumée.";"Saint Eloi, Sélection des Mousquetaires, Les Mousquetaires";"Intermarché, Banque alimentaire";"0";"0.4";"8.3";"5.4";"0.1";"0.2";"0.39370078740157477";"4";"1";"0";""
"3250390004578";"Cocos blancs";"France";"Cocos blancs";"Saint Eloi";"Intermarché";"0";"2.2";"35";"23";"0.4";"2.4";"0.003937007874015748";"26.3";"0.01";"0";""
"3250390004592";"Pois chiches";"France";"";"Saint Eloi";"";"0";"52";"47.5";"21.6";"0.7";"1.9";"0.003937007874015748";"11.9";"0.01";"0";""
"3250390004608";"Pois cassés";"France";"pois cassés";"Saint Eloi";"Intermarché";"0";"1.8";"50.5";"23.4";"0.3";"2.3";"0.01";"11.4";"0.025400000000000002";"0";""
"3250390119258";"Haricots rouges";"France";"Haricots rouges";"Saint Eloi";"Saint-Etienne";"0";"1.6";"41.2";"23.1";"0.2";"2.6";"0.003937007874015748";"16.9";"0.01";"0";""
"3250390255574";"Haricots rouges";"France";"";"Saint-Eloi";"";"0";"0";"0";"0";"0";"0";"0";"0";"0";"0";""
"3250392148249";"Lentilles Vertes (2 paquets + 1 paquet gratuit)";"France";"Lentilles vertes.";"Saint Eloi, Sélection des Mousquetaires, Les Mousquetaires";"Intermarché";"0";"1.4";"48.6";"25.1";"0.2";"0.9";"0.003937007874015748";"12.4";"0.01";"0";""
"3250390508830";"Riz en sachets cuisson Long Grain";"France";"Riz long grain étuvé de qualité supérieure.";"Saint Eloi";"Intermarché";"0";"1.3";"75.3";"7.5";"0.3";"0.5";"0.003937007874015748";"0";"0.01";"0";""
"3250391686667";"";"France";"";"Itinéraire des Saveurs";"";"0";"0";"0";"0";"0";"0";"0";"0";"0";"0";""
"3250390109204";"Riz long grain incollable";"France";"Riz long étuvé de qualité supérieure";"Saint Eloi";"Intermarché";"0";"0.8";"76.7";"7.9";"0.1";"0.6";"0.005";"1.7";"0";"0";""
"3250390109235";"Riz en sachets cuisson long grain";"France";"";"Saint Eloi";"";"0";"0.9";"78.7";"7.7";"0.2";"0.6";"0.003937007874015748";"0";"0.01";"0";""
"3250390325512";"Riz Rond ";"France";"Riz rond de qualité supérieure.";"Saint Eloi, Sélection des Mousquetaires, Les Mousquetaires";"Intermarché";"0";"0";"46";"4";"0";"0";"0";"0";"0";"0";""
"3250390321972";"Riz Basmati";"France";"Riz long grain de qualité supérieure.";"Saint Eloi";"Intermarché";"0";"1.1";"71.2";"9.7";"0.3";"0.5";"0.003937007874015748";"0";"0.01";"0";""
"3250390748236";"Riz long incollable ";"France";"";"Netto";"";"0";"1.1";"80.2";"7.1";"0";"0";"0";"0";"0";"0";""
"3250390748250";"Riz long";"France";"Riz long grain de qualité supérieure.";"Netto";"";"0";"0.6";"79.3";"7.3";"0.1";"0.2";"0.00393700787401575";"0";"0.01";"0";""
"3250391343348";"Haricots blancs à la tomate";"France";"Haricots blancs secs trempés, eau, concentré de tomates, sel, arôme naturel.";"Netto";"Netto";"0";"0.6";"14.3";"5";"0.2";"0.5";"0.394";"0";"0";"0";""
"3250390401223";"Lentilles Vertes";"France";"";"Regain Bio, Sélection des Mousquetaires, Les Mousquetaires";"Intermarché";"0";"0";"0";"0";"0";"0";"0";"0";"0";"0";""
"3250390722779";"Blé 10 min Trigo";"France";"Blé dur précuit.";"Saint Eloi, Sélection des Mousquetaires, Les Mousquetaires";"Banque alimentaire";"0";"1.7";"66.8";"14.6";"0.4";"0.7";"0.003937007874015748";"6.9";"0.01";"0";""
"3250391275717";"Riz Basmati Région d'Haryana";"France";"Riz long grain de qualité supérieure";"Itinéraire des Saveurs";"Intermarché";"0";"0.6";"78.3";"6.6";"0.15";"0";"5";"1.4";"12.7";"0";""
"3250391275687";"Riz thaï";"France";"Riz long grain de qualité supérieure.";"Itinéraire des Saveurs";"Intermarché";"0";"0.6";"78";"7.4";"0.1";"0.3";"0.003937007874015748";"0";"0.01";"0";""
"3250391011667";"Riz Long Semi Complet";"France";"";"";"";"0";"0";"0";"0";"0";"0";"0";"0";"0";"0";""
"3250390194866";"Lentilles préparées";"France";"Lentilles, eau, sel, arôme naturel.";"Saint Éloi, Sélection Intermarché";"Intermarché";"0";"0.5";"12.2";"6.1";"0.1";"0.5";"0.374015748031496";"4.2";"0.95";"0";""
"3250391746170";"Maïs doux en grains";"France";"Maïs, eau, sel marin, jus de citron.";"Saint Eloi";"";"0";"3.2";"11";"3";"0.7";"3.3";"0.14566929133858267";"0";"0.37";"0";""
"3250391372379";"Riz de Camargue";"France";"Riz long grain de qualité supérieure origine Camargue.";"Netto";"Netto";"0";"1.4";"80.9";"7.3";"0.3";"0.2";"0";"0";"0.01";"0";""
"3250391372287";"Lingots Blancs";"France";"Lingots blancs";"Netto";"Netto";"0";"2.1";"44.2";"19.7";"0.3";"2.7";"0.00393700787401575";"0";"0.01";"0";""
"3250392215248";"Quinoa Blond";"France, Belgium";"quinoa blond, Français, .";"Saint Eloi";"Intermarché";"0";"6.1";"57.2";"14.2";"0.7";"4.9";"0.003937007874015748";"0";"0.01";"0";""
"32521230004158";"Lentilles Vertes Bio";"France";"Lentilles vertes*
*Ingrédient issu de l'agriculture biologique";"Nature d'Origine";"Jardiland";"0";"0";"0";"0";"0";"0";"0";"0";"0";"0";""
"3258561120621";"Lentilles Blondes";"France";"";"Belle France";"";"0";"0";"0";"0";"0";"0";"0";"0";"0";"0";""
"3258561211510";"Lentilles cuisinées";"France";"LÉGUMES, carottes, poireaux, oignons, tomates.
SAUCE, eau, huile de colza, sel, farine de _blé_, exhausteur de goût, ail., lentilles précuites, du poids net total, glutamate monosodique, gélifiants, farine de graines de caroube et gomme guar";"Belle France, Francap Distribution";"";"0";"1.3";"9.7";"5.4";"0.2";"0.9";"0.39370078740157477";"3";"1";"0";""
"3250321418115";"Riz long grain incollable et qualité supérieure";"France";"Riz long grain étuvé de qualité supérieure.";"Saint Eloi";"Intermarché";"0";"0.9";"78.7";"7.7";"0.2";"0.6";"0.003937007874015748g";"0";"0.01g";"0";""
